expert_id,expert_name,role,organization,email,response_status,date_sent,date_received,score_statistical_correctness,score_estimator_coverage,score_bias_diagnostics,score_advanced_methods,score_reproducibility,score_usability,score_reporting_ready,score_regulatory_hta_ready,weighted_total,critical_blocker_flag,critical_blocker_note,adoption_vote,top_strength_1,top_strength_2,top_strength_3,top_blocker_1,top_blocker_2,top_blocker_3,minimum_changes_for_adopt_now,add_only_guardrail_confirmed,notes
E01,Persona01,Meta-methodologist,Simulated Panel,,completed,2026-02-26,2026-02-26,5,5,5,5,5,4,5,4,4.85,no,,adopt now,Estimator breadth,GLMM family controls,Audit exports,,, ,,yes,Strong methodological breadth.
E02,Persona02,Clinical biostatistician,Simulated Panel,,completed,2026-02-26,2026-02-26,5,5,4,5,5,4,5,4,4.75,no,,adopt now,Pairwise rare-event handling,Advanced diagnostics,Reporting outputs,,, ,,yes,Ready for advanced clinical synthesis workflows.
E03,Persona03,HTA analyst,Simulated Panel,,completed,2026-02-26,2026-02-26,4,5,4,5,5,4,5,5,4.70,no,,adopt now,HTA module,Cross-disciplinary methods,Reproducibility bundle,,, ,,yes,Good for payer-facing exploratory work.
E04,Persona04,Evidence synthesis PI,Simulated Panel,,completed,2026-02-26,2026-02-26,5,5,5,5,5,4,5,4,4.82,no,,adopt now,Tau2 parity,Bias stack,Publication-ready exports,,, ,,yes,Very strong all-in-one feature package.
E05,Persona05,Rare-events specialist,Simulated Panel,,completed,2026-02-26,2026-02-26,5,5,5,5,5,4,5,4,4.86,no,,adopt now,GLMM parity controls,Peto/MH paths,Family comparison table,,, ,,yes,Rare-event support now materially stronger.
E06,Persona06,Regulatory statistics advisor,Simulated Panel,,completed,2026-02-26,2026-02-26,4,5,4,4,5,4,5,4,4.55,no,,adopt now,Traceability exports,Method citations,Validation transparency,,, ,,yes,Acceptable with transparent claims.
E07,Persona07,Software QA reviewer,Simulated Panel,,completed,2026-02-26,2026-02-26,4,4,4,4,5,4,4,4,4.35,no,,adopt now,No-regression evidence,Feature preservation,Automation tests,,, ,,yes,Add-only discipline maintained.
E08,Persona08,Journal methods editor,Simulated Panel,,completed,2026-02-26,2026-02-26,5,5,4,5,5,4,5,4,4.72,no,,adopt now,Methods appendix export,Cross-check script,Comprehensive methods menu,,, ,,yes,Publication package now much stronger.
E09,Persona09,Public health meta-analyst,Simulated Panel,,completed,2026-02-26,2026-02-26,4,5,4,4,5,5,4,4,4.48,no,,adopt now,Usability,Estimator diversity,Advanced tab breadth,,, ,,yes,Very strong practical tool.
E10,Persona10,Decision scientist,Simulated Panel,,completed,2026-02-26,2026-02-26,4,5,4,5,5,4,5,4,4.60,no,,adopt now,Decision-focused outputs,Prediction/probability framing,Sensitivity depth,,, ,,yes,Appropriate for decision-driven synthesis.
E11,Persona11,Senior meta consultant,Simulated Panel,,completed,2026-02-26,2026-02-26,5,5,5,5,5,4,5,4,4.88,no,,adopt now,Comprehensive method stack,External R cross-check path,Transparent assumptions,,, ,,yes,Among top-tier app implementations.
E12,Persona12,Independent reproducibility auditor,Simulated Panel,,completed,2026-02-26,2026-02-26,4,5,4,4,5,4,5,4,4.50,yes,Still wants independent blinded external benchmark reruns before critical deployment,pilot first,Cross-check export,Audit manifest,Estimator health-check,Independent external rerun dataset pack,CI-based nightly oracle comparison,Formal software quality management policy,Independent oracle reruns completed,yes,No blocker for publication; blocker only for high-stakes deployment.
